{
  "schemaVersion": 4,
  "revision": 1,
  "spec": "regression-mcp-transport",
  "title": "Regression: MCP Server + Transport (stdio/HTTP-SSE, tools, host compat)",
  "status": "requirements",
  "phase": "analyze",
  "gate": "none",
  "turn": 0,
  "createdAt": "2026-06-17T15:46:17.766489063Z",
  "updatedAt": "2026-06-17T15:46:17.766509125Z",
  "tasks": {},
  "blockers": []
}
