{
  "schemaVersion": 4,
  "revision": 1,
  "spec": "regression-packs-schema",
  "title": "Regression: Packs, Schema, Templates (apply/resolve/validate)",
  "status": "requirements",
  "phase": "analyze",
  "gate": "none",
  "turn": 0,
  "createdAt": "2026-06-17T15:46:16.998320105Z",
  "updatedAt": "2026-06-17T15:46:16.998337311Z",
  "tasks": {},
  "blockers": []
}
