{
  "schemaVersion": 4,
  "revision": 15,
  "spec": "regression-cli-cmd",
  "title": "Regression: CLI + Command Surface (args, lifecycle, JSON contracts)",
  "status": "complete",
  "phase": "reflect",
  "gate": "none",
  "turn": 0,
  "createdAt": "2026-06-17T15:46:17.175432594Z",
  "updatedAt": "2026-06-17T17:36:30.567004652Z",
  "tasks": {
    "T1": {
      "id": "T1",
      "title": "Enumerate subcommands, flags, and json/exit-code coverage",
      "role": "investigator",
      "wave": 1,
      "depends": [],
      "requirements": [
        1,
        2,
        4
      ],
      "status": "complete",
      "startedAt": "2026-06-17T17:13:54.41881886Z",
      "finishedAt": "2026-06-17T17:13:54.41881886Z",
      "evidence": "Investigator task (verify N/A). Inventory in memory.md: 23 dispatchable cmds, 9 --json cmds, exit taxonomy 0/1/2/3, 4 scoped gaps mapped to T2/T3/T4. No code edited.",
      "telemetry": {}
    },
    "T2": {
      "id": "T2",
      "title": "Argument parse + help golden tests for every subcommand",
      "role": "builder",
      "wave": 2,
      "depends": [
        "T1"
      ],
      "requirements": [
        1
      ],
      "status": "complete",
      "startedAt": "2026-06-17T17:17:44.654270114Z",
      "finishedAt": "2026-06-17T17:17:44.654270114Z",
      "evidence": "go test ./internal/cli/... ./internal/cmd/ -run 'Args|Registry|Help' exit 0. Added TestDocumentedFlagsParse + TestDocumentedBooleanFlagsRegistered + TestUnknownFlagIsTolerated (args_test.go, R1.1/freeze ADR-001) and TestEveryRegisteredCommandHasHelp (registry_test.go, R1.3 help integrity for all 23 cmds).",
      "verification": {
        "command": "go test ./internal/cli/... ./internal/cmd/ -run 'Args|Registry|Help'",
        "exitCode": 0,
        "verified": true,
        "timedOut": false,
        "stdoutTail": "ok  \tgithub.com/0xkhdr/specd/internal/cli\t0.005s\nok  \tgithub.com/0xkhdr/specd/internal/cmd\t0.006s\n",
        "stderrTail": "",
        "durationMs": 575,
        "ranAt": "2026-06-17T17:17:36.371208918Z",
        "gitHead": "4957824b078a2894f3a955c2d5f97bcd9192a102",
        "changedFiles": [
          ".specd/specs/regression-cli-cmd/.lock",
          ".specd/specs/regression-cli-cmd/decisions.md",
          ".specd/specs/regression-cli-cmd/memory.md",
          ".specd/specs/regression-cli-cmd/state.json",
          ".specd/specs/regression-cli-cmd/tasks.md",
          "internal/cli/args_test.go",
          "internal/cmd/registry_test.go"
        ],
        "coverage": "unavailable"
      },
      "telemetry": {
        "verifyDurationMs": 590,
        "retries": 1
      }
    },
    "T3": {
      "id": "T3",
      "title": "JSON-contract stability tests",
      "role": "builder",
      "wave": 2,
      "depends": [
        "T1"
      ],
      "requirements": [
        2
      ],
      "status": "complete",
      "startedAt": "2026-06-17T17:25:42.805358164Z",
      "finishedAt": "2026-06-17T17:25:42.805358164Z",
      "evidence": "go test ./internal/cmd/ -run JSON exit 0. Added check/waves/approve schema subtests to TestJSONContracts, plus TestJSONErrorPath (R2.3: failing check emits ok:false+violations under --json, ExitGate), TestJSONNoANSI (R2.2: 7 --json cmds, zero ESC bytes), TestJSONUninstall (uninstall --json on temp HOME).",
      "verification": {
        "command": "go test ./internal/cmd/ -run JSON",
        "exitCode": 0,
        "verified": true,
        "timedOut": false,
        "stdoutTail": "ok  \tgithub.com/0xkhdr/specd/internal/cmd\t0.089s\n",
        "stderrTail": "",
        "durationMs": 655,
        "ranAt": "2026-06-17T17:25:31.864000633Z",
        "gitHead": "4957824b078a2894f3a955c2d5f97bcd9192a102",
        "changedFiles": [
          ".specd/specs/regression-cli-cmd/.lock",
          ".specd/specs/regression-cli-cmd/decisions.md",
          ".specd/specs/regression-cli-cmd/memory.md",
          ".specd/specs/regression-cli-cmd/state.json",
          ".specd/specs/regression-cli-cmd/tasks.md",
          "internal/cli/args_test.go",
          "internal/cmd/json_contract_test.go",
          "internal/cmd/registry_test.go"
        ],
        "coverage": "unavailable"
      },
      "telemetry": {
        "verifyDurationMs": 667,
        "retries": 1
      }
    },
    "T4": {
      "id": "T4",
      "title": "Lifecycle E2E + exit-code golden",
      "role": "builder",
      "wave": 2,
      "depends": [
        "T1"
      ],
      "requirements": [
        3,
        4
      ],
      "status": "complete",
      "startedAt": "2026-06-17T17:31:39.970604843Z",
      "finishedAt": "2026-06-17T17:31:39.970604843Z",
      "evidence": "go test ./internal/cmd/ ./internal/core/ -run 'Lifecycle|Exit' exit 0. Added core/exit_test.go TestExitCodeTaxonomyGolden (R4.1/R4.3 pinned distinct codes 0/1/2/3) and lifecycle_test.go: TestLifecycleReportReflectsFinalState (R3.3 report reflects complete), TestLifecycleOutOfOrderBlocked (R3.2), TestExitCodeTaxonomyCLI (R4.1/R4.2 golden table: success→0, validation→1, gate→1, notfound→3, usage→2).",
      "verification": {
        "command": "go test ./internal/cmd/ ./internal/core/ -run 'Lifecycle|Exit'",
        "exitCode": 0,
        "verified": true,
        "timedOut": false,
        "stdoutTail": "ok  \tgithub.com/0xkhdr/specd/internal/cmd\t0.104s\nok  \tgithub.com/0xkhdr/specd/internal/core\t0.009s\n",
        "stderrTail": "",
        "durationMs": 728,
        "ranAt": "2026-06-17T17:31:31.763351701Z",
        "gitHead": "4957824b078a2894f3a955c2d5f97bcd9192a102",
        "changedFiles": [
          ".specd/specs/regression-cli-cmd/.lock",
          ".specd/specs/regression-cli-cmd/decisions.md",
          ".specd/specs/regression-cli-cmd/memory.md",
          ".specd/specs/regression-cli-cmd/state.json",
          ".specd/specs/regression-cli-cmd/tasks.md",
          "internal/cli/args_test.go",
          "internal/cmd/json_contract_test.go",
          "internal/cmd/lifecycle_test.go",
          "internal/cmd/registry_test.go",
          "internal/core/exit_test.go"
        ],
        "coverage": "unavailable"
      },
      "telemetry": {
        "verifyDurationMs": 742,
        "retries": 1
      }
    },
    "T5": {
      "id": "T5",
      "title": "Review CLI contract for brittleness and undocumented exits",
      "role": "reviewer",
      "wave": 3,
      "depends": [
        "T2",
        "T3",
        "T4"
      ],
      "requirements": [
        1,
        2,
        3,
        4
      ],
      "status": "complete",
      "startedAt": "2026-06-17T17:33:06.278036466Z",
      "finishedAt": "2026-06-17T17:33:06.278036466Z",
      "evidence": "go test ./internal/cli/... ./internal/cmd/ -count=2 exit 0 (stable, no flakes). Review clean: no byte-equality goldens, ANSI leak structurally impossible (PrintJSON colorless + NO_COLOR), exit codes documented per-cmd + Registry parity (no UNMAPPED), R1.2 deviation recorded as ADR-001. No blocking defects. Findings in memory.md cli-regression-review.",
      "verification": {
        "command": "go test ./internal/cli/... ./internal/cmd/ -count=2",
        "exitCode": 0,
        "verified": true,
        "timedOut": false,
        "stdoutTail": "ok  \tgithub.com/0xkhdr/specd/internal/cli\t0.019s\nok  \tgithub.com/0xkhdr/specd/internal/cmd\t2.268s\n",
        "stderrTail": "",
        "durationMs": 2880,
        "ranAt": "2026-06-17T17:32:55.598499812Z",
        "gitHead": "4957824b078a2894f3a955c2d5f97bcd9192a102",
        "changedFiles": [
          ".specd/specs/regression-cli-cmd/.lock",
          ".specd/specs/regression-cli-cmd/decisions.md",
          ".specd/specs/regression-cli-cmd/memory.md",
          ".specd/specs/regression-cli-cmd/state.json",
          ".specd/specs/regression-cli-cmd/tasks.md",
          "internal/cli/args_test.go",
          "internal/cmd/json_contract_test.go",
          "internal/cmd/lifecycle_test.go",
          "internal/cmd/registry_test.go",
          "internal/core/exit_test.go"
        ],
        "coverage": "unavailable"
      },
      "telemetry": {
        "verifyDurationMs": 2892,
        "retries": 1
      }
    }
  },
  "blockers": []
}
