{
  "schemaVersion": 4,
  "revision": 15,
  "spec": "dashboard-web",
  "title": "Dashboard Decoupling from VS Code",
  "status": "complete",
  "phase": "reflect",
  "gate": "none",
  "turn": 0,
  "createdAt": "2026-06-16T22:49:50.013704227Z",
  "updatedAt": "2026-06-16T23:08:44.208785329Z",
  "tasks": {
    "T1": {
      "id": "T1",
      "title": "Audit the VS Code extension and existing serve/watch surface",
      "role": "investigator",
      "wave": 1,
      "depends": [],
      "requirements": [
        1,
        3
      ],
      "status": "complete",
      "startedAt": "2026-06-16T23:01:57.128687844Z",
      "finishedAt": "2026-06-16T23:01:57.128687844Z",
      "evidence": "Audit: editors/vscode/extension.js only cp.spawn('specd serve') + iframes http://127.0.0.1:port/ (L43,58-60); owns no dashboard logic. Routes to preserve in serve.go: GET / (RenderHTML), GET /api/report (JSON), 405 non-GET (Allow:GET), 404 via RequireSpec/LoadState. Reusable sseHandler(root,filter) in watch_sse.go mountable at /events; helpers ListSpecs/loadReportData/watchInterval/collectChanges exist. RenderHTML in core/report.go:267."
    },
    "T2": {
      "id": "T2",
      "title": "Record the extension-removal decision",
      "role": "investigator",
      "wave": 1,
      "depends": [
        "T1"
      ],
      "requirements": [
        1
      ],
      "status": "complete",
      "startedAt": "2026-06-16T23:02:07.677706411Z",
      "finishedAt": "2026-06-16T23:02:07.677706411Z",
      "evidence": "ADR-001 appended to decisions.md: outright removal of editors/vscode/ chosen over deprecation stub; migration path = docs/dashboard.md browser-first specd serve. Consequences recorded."
    },
    "T3": {
      "id": "T3",
      "title": "Extend serve with a multi-spec index and SSE mount",
      "role": "builder",
      "wave": 2,
      "depends": [
        "T2"
      ],
      "requirements": [
        2,
        3,
        4,
        5
      ],
      "status": "complete",
      "startedAt": "2026-06-16T23:03:36.253330305Z",
      "finishedAt": "2026-06-16T23:03:36.253330305Z",
      "evidence": "Extended NewServeHandler: GET / spec index via ListSpecs, GET /s/\u003cslug\u003e report HTML, GET /api/report?spec= JSON (defaults to slug), /events mounts reused sseHandler. 405 non-GET, 404 missing spec, loopback default unchanged. go build + go vet pass (verify exit 0).",
      "verification": {
        "command": "go build ./... \u0026\u0026 go vet ./internal/cmd/...",
        "exitCode": 0,
        "verified": true,
        "timedOut": false,
        "stdoutTail": "",
        "stderrTail": "",
        "durationMs": 956,
        "ranAt": "2026-06-16T23:03:30.239032213Z",
        "gitHead": "90300e989cf47c06b2379cef13cc0b1f8e228ca7"
      }
    },
    "T4": {
      "id": "T4",
      "title": "Make the rendered dashboard live and responsive",
      "role": "builder",
      "wave": 2,
      "depends": [
        "T3"
      ],
      "requirements": [
        4,
        6
      ],
      "status": "complete",
      "startedAt": "2026-06-16T23:04:51.956872148Z",
      "finishedAt": "2026-06-16T23:04:51.956872148Z",
      "evidence": "RenderHTML now emits viewport meta, @media responsive CSS, and inlined EventSource('/events') client that re-fetches /api/report + /s/\u003cslug\u003e and swaps body on a frontier delta — self-contained, no external assets, no LLM. New TestRenderHTMLLiveResponsive green.",
      "verification": {
        "command": "go test ./internal/core/... -race -count=1 -run RenderHTML",
        "exitCode": 0,
        "verified": true,
        "timedOut": false,
        "stdoutTail": "ok  \tgithub.com/0xkhdr/specd/internal/core\t1.023s\n",
        "stderrTail": "",
        "durationMs": 1902,
        "ranAt": "2026-06-16T23:04:50.03882816Z",
        "gitHead": "90300e989cf47c06b2379cef13cc0b1f8e228ca7"
      }
    },
    "T5": {
      "id": "T5",
      "title": "Remove the VS Code extension and document migration",
      "role": "builder",
      "wave": 2,
      "depends": [
        "T4"
      ],
      "requirements": [
        1
      ],
      "status": "complete",
      "startedAt": "2026-06-16T23:05:54.714865673Z",
      "finishedAt": "2026-06-16T23:05:54.714865673Z",
      "evidence": "Deleted editors/vscode/ (git rm; editors/ dir gone per ADR-001). Added docs/dashboard.md (browser-first usage, routes, live SSE, network safety, VS Code migration steps); linked from docs/README.md; removed editors/ line from concepts.md tree. verify: test ! -d editors/vscode \u0026\u0026 test -f docs/dashboard.md → exit 0.",
      "verification": {
        "command": "test ! -d editors/vscode \u0026\u0026 test -f docs/dashboard.md",
        "exitCode": 0,
        "verified": true,
        "timedOut": false,
        "stdoutTail": "",
        "stderrTail": "",
        "durationMs": 1,
        "ranAt": "2026-06-16T23:05:54.700044538Z",
        "gitHead": "90300e989cf47c06b2379cef13cc0b1f8e228ca7"
      }
    },
    "T6": {
      "id": "T6",
      "title": "Extend serve tests for index, 404, 405, and SSE",
      "role": "builder",
      "wave": 3,
      "depends": [
        "T5"
      ],
      "requirements": [
        2,
        3,
        4
      ],
      "status": "complete",
      "startedAt": "2026-06-16T23:07:50.103463115Z",
      "finishedAt": "2026-06-16T23:07:50.103463115Z",
      "evidence": "serve_test.go rewritten + commands_test.go serve tests updated for multi-spec routes: TestServeParity(/s/auth byte-identical), TestServeIndex(/ lists auth+billing links), TestServeReadOnly(405 on /,/s/auth,/api/report + 404 /s/nope), TestServeEventsMount(/events SSE text/event-stream + valid FrontierEvent frame). go test -run Serve -race → ok.",
      "verification": {
        "command": "go test ./internal/cmd/... -race -count=1 -run Serve",
        "exitCode": 0,
        "verified": true,
        "timedOut": false,
        "stdoutTail": "ok  \tgithub.com/0xkhdr/specd/internal/cmd\t1.120s\n",
        "stderrTail": "",
        "durationMs": 1878,
        "ranAt": "2026-06-16T23:07:48.21091705Z",
        "gitHead": "90300e989cf47c06b2379cef13cc0b1f8e228ca7"
      }
    },
    "T7": {
      "id": "T7",
      "title": "Final gate review of the dashboard spec",
      "role": "verifier",
      "wave": 3,
      "depends": [
        "T6"
      ],
      "requirements": [
        1,
        2,
        3,
        4,
        5,
        6
      ],
      "status": "complete",
      "startedAt": "2026-06-16T23:08:36.422390492Z",
      "finishedAt": "2026-06-16T23:08:36.422390492Z",
      "evidence": "Final review: ./specd check dashboard-web all gates green; go test ./internal/cmd/... ./internal/core/... -race -count=1 → ok ok. Read-only + loopback invariants intact (405/404 tests), editors/vscode/ removed, docs/dashboard.md present. No behaviour added.",
      "verification": {
        "command": "./specd check dashboard-web \u0026\u0026 go test ./internal/cmd/... ./internal/core/... -race -count=1",
        "exitCode": 0,
        "verified": true,
        "timedOut": false,
        "stdoutTail": "✓ check passed — all gates green for 'dashboard-web'\nok  \tgithub.com/0xkhdr/specd/internal/cmd\t2.305s\nok  \tgithub.com/0xkhdr/specd/internal/core\t12.004s\n",
        "stderrTail": "",
        "durationMs": 12732,
        "ranAt": "2026-06-16T23:08:18.10052064Z",
        "gitHead": "90300e989cf47c06b2379cef13cc0b1f8e228ca7"
      }
    }
  },
  "blockers": []
}
